datetime,city,state,country,shape,duration (seconds),duration (hours/min),comments,date posted,latitude,longitude
10/1/1987 19:00,victoria (canada),bc,ca,sphere,900.0,15mins,Large red and orange sphere&#44 balanced on a rock in 1987.,10/30/2006,46.216667,-63.483333
10/1/1987 20:00,roseburg (7 miles northwest of),or,us,oval,1800.0,30 mins.,Two small glowing oval orange objects and one larger triangle craft in rural Oregon.,10/31/2008,43.21666670000001,-123.3405556
10/1/1987 21:00,alstead,nh,us,fireball,1800.0,30 mins.,sitting   in  a  car in a open  field&#44 keeping in mind this is in a  town where  we are in  the hills.  the  field during  the day has,1/19/2005,43.1488889,-72.36111109999999
10/1/1987 23:00,louisburg,nc,us,triangle,180.0,3 minutes,Large black triangular object with lights on each side and at the points making no discernible noise.,8/5/2001,36.0988889,-78.3013889
10/1/1989 16:00,mackay,id,us,disk,180.0,2 to 3 min,LARGE SAUCER,2/14/2010,43.9147222,-113.6125
10/1/1989 18:00,winchester (near),ky,us,oval,300.0,5 minutes,3 starlike objects land on 1 large orange oval object in full daylight in sight of dozens of witnesses.,3/11/2006,37.99,-84.1797222
10/1/1989 20:00,jacksonville,il,us,circle,300.0,five minutes,Three gold circle UFOs fly in formation&#44 warp drive away and disappear.,11/21/2010,39.7338889,-90.22888890000002
10/1/1989 20:00,pawling,ny,us,oval,300.0,5 minutes,Large oval craft with lights above house on north side of Route 55 between Pawling and Freedom Plains&#44 NY&#44 late 1980&#39s.,5/11/2005,41.5619444,-73.6030556
10/1/1989 21:30,carmichael,ca,us,rectangle,10.0,10sec.,Black rectangular craft over carmichael.,7/25/2004,38.6172222,-121.3272222
10/1/1989 21:30,orono,me,us,disk,20.0,15-20 seconds,Silent Lo-flying Craft with Dome and Bright White Lights,11/26/2003,44.88305560000001,-68.6725
10/1/1990 17:00,pateros,wa,us,oval,300.0,05min,One Gray metal oval disc&#44 aporx. 10&#39x50&#39&#44 clear sky&#44  1 qaurter mile away,3/11/2006,48.0511111,-119.9022222
10/1/1990 20:00,san pedro,ca,us,light,120.0,2min,a small light in the sky&#44 making the shape of a equiangular triangle then shooting away at a high rate of speed.,1/19/2005,33.7358333,-118.2913889
10/1/1990 22:15,jamestown,ny,us,light,1200.0,20 minutes,A row of porthole shaped lights hovering at an altitude of approx. 500 feet spanning a distance of about 1 mile.,4/27/2007,42.0969444,-79.2355556
10/1/1991 14:45,easley,sc,us,other,900.0,fifteen minutes,Hockey-puck-shaped-thing.,2/22/2002,34.8297222,-82.6016667
10/1/1991 17:00,wilmington,ca,us,circle,900.0,15 minutes,Patterned disks over southern california sky.,2/14/2008,33.78,-118.2616667
10/1/1991 18:00,maryville,tn,us,cigar,300.0,5 minutes,Silver&#44 cigar shaped object north of downtown Maryville&#44 TN in or around 1991,9/24/2012,35.7563889,-83.9705556
10/1/1991 18:30,little rock,ar,us,triangle,300.0,5 minutes,Triangular arrangements of lights appearing to begin to land on freeway&#44 miltary-ish cars mobilze around it,8/5/2012,34.7463889,-92.2894444
10/1/1991 20:30,mckenzie,tn,us,disk,900.0,15 minutes,I saw a saucer shaped obiect with blue&#44 red&#44 green flashing lights on the way home from college.,3/31/2008,36.1325,-88.51861109999999
10/1/1991 21:30,las vegas,nv,us,cigar,5.0,5 seconds,For seven years I have kept this fairly quiet. I was walking my dog on a clear dark night where I live on the north west side of Las Ve,1/28/1999,36.175,-115.1363889
10/1/1991 22:00,lafayette,ga,us,other,900.0,15 min.,A small globe descended from beneath the larger craft.,1/17/2004,34.7047222,-85.2819444
10/1/1992 01:30,echo summit (sierra at tahoe ski area),ca,,sphere,90.0,90 seconds,This was an object that could hover stationary and then accelerate to 2&#44000 mph or possibly much higher... it would move instantaneousl,1/22/2000,38.812963,-120.030183
10/1/1992 17:30,dublin (near warner robins),ga,us,triangle,1200.0,20 minutes,While driving home from out-of-town&#44 I watched a dot in the sky that later hoovered over my car.,11/20/2002,32.5402778,-82.90388890000001
10/1/1992 18:00,springfield,mo,us,egg,90.0,90 seconds,MISSOURI INVESTIGATORS GROUP Report:  We saw a large football shaped object hovering above an apartment complex .,12/12/2009,37.2152778,-93.2980556
10/1/1992 19:00,longview,tx,us,unknown,20.0,00:20,I observed one nite several objects flying in a kind of oval formation and change to a vee formation. There wasn&#39t any sound.,11/9/1999,32.50055560000001,-94.7402778
10/1/1993 02:00,tempe,az,us,triangle,900.0,15 minutes,My friend and I saw a triangle made of smaller triangles fly over us at a low altitude.,1/28/1999,33.4147222,-111.9086111
10/1/1993 20:00,delaware,oh,us,light,7200.0,2 hours,Lights in localized semi-rural area&#44 beams emitted&#44 possible sound&#44 possible contact&#44 video tape,2/14/2008,40.2986111,-83.0680556
10/1/1993 20:00,pryor,mt,us,light,1800.0,20-30 minutes,Floating Light&#44 Like a Spotlight,11/3/2005,45.4297222,-108.5325
10/1/1994 11:30,pawnee,ok,us,triangle,1200.0,20 min,It was triangle shape with white lights at each corner of it and a large red one in the middle.,4/26/1999,36.3377778,-96.8036111
10/1/1994 13:13,new york city,ny,us,disk,15.0,15 seconds,a flying colorful disc above my car&#44 near Erie.  ((NUFORC Note:  Possible hoax??  PD)),6/12/2007,40.7141667,-74.0063889
10/1/1994 17:00,tylertown/mccomb (between; on hwy. 98 ),ms,,changing,1200.0,20 minutes,orange molten-metal&#44 crescent-shaped object paralleling car for 15 - 20 minutes,6/12/2008,31.243787,-90.453153
10/1/1994 20:00,chicopee,ma,us,changing,300.0,5 minutes,Chicopee State Park&#44 Craft seemed to be shooting balls of light or breaking up,12/16/2005,42.1486111,-72.6083333
10/1/1994 20:00,santa barbara,ca,us,triangle,3.0,3 seconds,Black triangle,10/12/2001,34.4208333,-119.6972222
10/1/1994 21:00,warsaw,mo,us,cigar,600.0,10 minutes,Triangle shaped object hovering above the water.,11/28/2007,38.24305560000001,-93.3816667
10/1/1994 23:00,las vegas,nv,us,circle,5.0,5 seconds,Bright green object in flight allmost colided with my aircraft.,10/15/2002,36.175,-115.1363889
10/1/1994 23:30,fredericksburg,pa,us,disk,300.0,5minutes,I was driving by on the road and seen this saucer &#44 it was ON the ground near a house. I stopped down the road and got out to get a clo,11/20/2002,40.44361110000001,-76.4286111
10/1/1995 12:00,iowa city,ia,us,,20.0,20 sec.,Man witnesses 2 &quot;white&quot; aircraft rendezvous at high altitude&#44 fly toward bizarre obj. approaching very fast.  Obj. &quot;sparkled.&quot;,11/2/1999,41.66111110000001,-91.53
10/1/1995 14:00,lake oswego,or,us,,5.0,5 sec.,Man reports brief sighting of peculiar white object in daytime sky.  (See later sighting on same day.),11/2/1999,45.4208333,-122.66944440000002
10/1/1995 16:30,lake oswego,or,us,,90.0,90 sec.,Man reports witnessing 2 &quot;diamond-shaped objects overhead. (Second sighting on same day.),11/2/1999,45.4208333,-122.66944440000002
10/1/1995 17:00,ashland,ky,us,disk,300.0,less than 5 minutes,Disintegrating object.,10/31/2003,38.4783333,-82.6380556
10/1/1995 18:30,williamsburg,pa,us,rectangle,600.0,10 minutes,Low flying rectangular object with very bright lights on all sides.,5/24/2005,40.46194439999999,-78.2
10/1/1995 21:00,taunton (near) (uk/england),,gb,light,60.0,1 minute,The object was made up of a formation of small lights&#44 plus one light moving independantly  around main formation,1/29/2002,51.021111,-3.104722
10/1/1995 22:00,tinley park,il,us,other,20.0,20 seconds,Sheild shaped craft spotted at outdoor concert with orange glow&#44 moivng at high speed.,3/11/2003,41.5733333,-87.7844444
10/1/1995 22:00,wantagh,ny,us,triangle,60.0,1 minute,Triangle with three large&#44 dim&#44 amber lights flew rapidly overhead and rotated once.,10/31/2008,40.6836111,-73.5105556
10/1/1995 22:30,austin,tx,us,,5400.0,90 min.,Man reports wife went out to empty trash&#44 disappears for 90 min.&#44 returns disoriented and acting strangely.,11/2/1999,30.2669444,-97.7427778
10/1/1995 23:00,dover,nh,us,triangle,600.0,10 minutes,six light triangle in dover,9/24/2003,43.1977778,-70.8741667
10/1/1996 01:00,lake berryessa,ca,,sphere,15.0,15 seconds,Deep Blue Sphere seen over Lake Berryessa&#44 California,10/30/2012,38.609741,-122.254045
10/1/1996 01:00,west houston (greenridge @ westiemer rd.; near galleria),tx,us,formation,30.0,30 seconds,Three bright orange-white lights moving in a V formation from northeast to Southwest The center light would change position front to re,1/28/1999,29.763055600000005,-95.3630556
10/1/1996 05:30,bainbridge,oh,us,triangle,180.0,3 minutes,Low-flying triangular object,10/11/2005,39.2275,-83.2705556
10/1/1996 08:00,new york city (manhattan),ny,us,oval,300.0,5 mintues,Possible UFO Sighting&#44 Manhattan&#44 New York 1996,2/14/2008,40.7141667,-74.0063889
10/1/1996 17:00,cupertino,ca,us,sphere,600.0,10 mins,Metalic ball floating motionless in high winds over San Jose&#44 CA.,8/12/2008,37.3230556,-122.0311111
10/1/1996 18:00,safford,az,us,sphere,30.0,30 sec.,Antigravity flying sphere,10/12/2001,32.8338889,-109.7069444
10/1/1996 22:30,the woodlands,tx,us,fireball,180.0,2-3 minutes,2 orange fireballs moving across sky ~ crazy acrobatics,12/12/2011,30.1577778,-95.4891667
10/1/1997 00:00,bemidji,mn,us,triangle,600.0,10 minutes,In october 1997 my dad and I seen 3 lights in the shape of a triangle tumbling over each other in Bemidji Minnesota.,12/3/2004,47.47361110000001,-94.88
10/1/1997 01:20,garland,tx,us,rectangle,40.0,40 seconds,I had just got off of work at 1:15 a.m. I was driving down to the Hypermart USA because it was the only store open 24 hrs. I notice thi,11/20/2001,32.9125,-96.6386111
10/1/1997 03:00,jefferson,ny,us,other,300.0,05 minutes,Rural mountain area. Tree covered hill. 1860&#39 MSL. I awoke to see a bright white light approx 1&#44500&#39 so east of my camper. The circular,10/2/1999,42.48111110000001,-74.6108333
10/1/1997 08:00,oregon (rural),or,,rectangle,20.0,20 seconds,noisy rectangular object falling from the sky and crash landed,5/15/2006,43.804133,-120.554201
10/1/1997 09:00,charlotte,nc,us,cigar,120.0,2 minutes,Cigar shaped&#44 silvery-white object @ 500-1&#4400&#39 up&#44 in a clear blue&#44 cloudless sky.  Object was silent&#44 immobile&#44 and when I glanced dow,1/28/1999,35.226944399999994,-80.8433333
10/1/1997 19:00,green bay,wi,us,light,1200.0,15-20 minutes,Three red lights,4/14/2009,44.5191667,-88.0197222
10/1/1997 19:00,pelzer,sc,us,triangle,180.0,3 minutes,Large&#44 black&#44 triangular&#44 object flew low and silent over South Carolina state prison yard.,1/10/2009,34.6422222,-82.45611109999999
10/1/1997 21:00,hyannis,ma,us,triangle,60.0,1 minute,WIFE AND I DROVE ONTO START OF OUR STREET&#44 NOTICED TWO LIGHTS NOT USUALLY THERE.  STOPPED CAR&#44 GOT OUT&#44 SAW TWO CRAFTS.  NO NOISE AND H,6/23/1999,41.6527778,-70.2833333
10/1/1997 21:30,bourbonnais,il,us,triangle,60.0,-1 min,I was traveling home from visiting my dad in Carle Hospital on 113 heading towards Custer Park&#44 IL. It was dark out I was in farm count,1/19/2005,41.1416667,-87.875
10/1/1997 21:30,oakland,or,us,light,60.0,1 minute,High altitude light turned&#44 dropped several Thousand feet&#44 turned and disappeared&#33,11/19/1998,43.4222222,-123.2972222
10/1/1997 21:55,martinsville,va,us,other,300.0,5 mins,Yellow/Orange lighted object moving from NE to SW. Very bright toy top shape with no sound. About the size of a penny held at arm reach,1/28/1999,36.6913889,-79.8727778
10/1/1997 22:00,summerville,sc,us,triangle,1200.0,20 min,Triangular shape with lights in a V&#44 no sound&#44 very slow moving.,10/30/2006,33.0183333,-80.1758333
10/1/1997 23:15,lakeland,fl,us,light,60.0,1 minute,3 oval shaped reddish-orange lights flew over my house&#44 heading directly south. The lights formed a perfect triangle&#44 but flying severe,1/28/1999,28.039166700000006,-81.95
10/1/1998 00:00,logan,ut,us,triangle,120.0,a few minutes,We saw 5 triangular objects moving at high altitude to the south&#44 circling each other like small birds.,7/5/1999,41.73555560000001,-111.8336111
10/1/1998 00:10,portland,or,us,light,5.0,5 sec,GETTING OUT OF MY CAR TO WORK&#44I SAW A WIDE GREEN STREAK OF LIGHT IN THE SOUTHWEST SKY&#44FROM SKY TO GROUND...........,11/1/1998,45.5236111,-122.675
10/1/1998 01:30,st. paul,or,us,fireball,5.0,5 seconds,We own a farm here in St. Paul. We (my mother and I) had pulled off to the side of the road to check on some farm equipment we had in a,11/1/1998,45.2113889,-122.9755556
10/1/1998 02:00,nisqually,wa,us,disk,180.0,3 min.,burnt out disk  gets ride from trucker to air force base,11/2/2004,47.0566667,-122.7
10/1/1998 04:30,rio rancho,nm,us,fireball,120.0,2 min.,Sighted during the major meteor shower last year.,4/2/1999,35.2333333,-106.6638889
10/1/1998 05:30,bayfield,co,us,light,1800.0,30 minutes,Large light object in sky with lightning storm and huge beam of light from below in  southern Colorado,1/3/2001,37.22555560000001,-107.5975
10/1/1998 10:00,san francisco,ca,us,sphere,420.0,6-7 minutes,Soccer Balls over SF,2/3/2012,37.775,-122.4183333
10/1/1998 13:30,elgin,il,us,disk,1200.0,20 minutes,I can only say that I know what I saw&#44  I even took a digital picture of it.  1:30 in the afternoon&#44  clear blue sky&#44  an airplane head,10/19/1999,42.0372222,-88.28111109999998
10/1/1998 16:00,del mar,ca,us,fireball,4.0,4 seconds,Fireball streaked across the sky and fizzled out 5 miles inland,4/2/1999,32.959444399999995,-117.26444440000002
10/1/1998 18:50,la jolla (over),ca,us,fireball,7.0,six to seven seconds,At dusk&#44 an orange&#44white&#44pink&#44and voilet color fireball traveled totally horizontal west to east&#44not as fast as a shooting star&#44and the,11/19/1998,32.8472222,-117.2733333
10/1/1998 18:56,manchester,nh,us,oval,120.0,2min,hovering above city landfill.  beam of light from craft to ground.,11/1/1998,42.9955556,-71.45527779999998
10/1/1998 21:00,clarinda,ia,us,triangle,60.0,60 seconds,silent and large UFO just above tree tops.,8/5/2009,40.7419444,-95.0380556
10/1/1998 21:00,warrington (uk/england),,gb,fireball,8.0,8 seconds,It was a clear night&#44 the fireball was huge and you could almost hear a rumbling. It shot across the sky from left to right at an incre,7/26/2002,53.38333299999999,-2.6
10/1/1998 21:02,mt sterling,il,,formation,900.0,15 minutes,3 orange fireballs in triangle formation - 1 triangle shaped craft without sound.,11/1/1998,39.987271,-90.763463
10/1/1998 21:15,ipava,il,us,triangle,900.0,15 min,An object which resmbled car headlights in the sky was spotted to SW.  A discernable craft flew directly overhead and proceeded to disa,11/1/1998,40.3513889,-90.3244444
10/1/1998 23:10,mosinee,wi,us,other,300.0,5 minutes,I was driving south on U.S. Hwy 51 and I saw a craft that didn&#39t move for 5 or more minutes.  The craft also made no noise.,11/19/1998,44.7930556,-89.7030556
10/1/1999 00:30,san antonio,tx,us,fireball,30.0,30 seconds,Observed amber bright light decending for apx. 20 seconds.,10/19/1999,29.4238889,-98.4933333
10/1/1999 01:00,oak brook,il,us,light,60.0,i minute,a green-blue light comes out and down out of a cloud&#44 and goes back into the cloud,5/14/2002,41.8327778,-87.9288889
10/1/1999 04:00,portland,or,us,light,25.0,15-25 seconds,looking west the object appeared approx near the top of our atmosphere. It was huge&#33 It at first just seemed to appear out of thin air.,11/2/1999,45.5236111,-122.675
10/1/1999 04:40,elyria,oh,us,triangle,300.0,5or more minutes,The front was shaped like a triangle&#44 with two lights on the wing tips. Blueish-gray in color...Low rumbling sound&#44 Moving very slow. ,10/2/1999,41.3683333,-82.1077778
10/1/1999 17:00,new york city (manhattan),ny,us,unknown,5.0,5 seconds,I witnessed a being in the middle of the day in Manhattan about six and a half feet&#44 its face definately not human?,2/18/2001,40.7141667,-74.0063889
10/1/1999 18:12,norman,ok,us,cigar,120.0,2 min,Soundless cigar shaped object(s) transited South to North. Weather- clear&#44 unlimited visibility&#44 near 70 degrees F.,10/19/1999,35.2225,-97.4391667
10/1/1999 19:00,las vegas,nv,us,light,15.0,app. 15 seconds,A moving object which possibly changed speed and direction in an unorthodox manner,10/2/1999,36.175,-115.1363889
10/1/1999 19:00,nellis air force base (50-100 miles east of),nv,,light,180.0,3 minutes,On Friday October 1 around 7 in the evening I was driving south and about 50 miles east of Nellis Air Force base.I noticed an bright ob,11/17/1999,36.241416,-115.050807
10/1/1999 20:00,miami,fl,us,unknown,25.0,25 sec.,Red and Green light in the sky.,10/19/1999,25.7738889,-80.1938889
10/1/1999 22:05,independence,mo,us,chevron,15.0,15 seconds,Looked up an saw tiny points of light creating the shape of a Chevron.,10/19/1999,39.091111100000006,-94.4152778
10/1/1999 23:00,blankenberge (belgium),,,formation,10.0,10 seconds,upside down V formation of 9 birght lights on high altitude changed to M formation in less than a second,4/8/2002,51.312374,3.132768
10/1/2000 01:00,vaughn,wa,us,formation,540.0,9:00 minutes,The lights changed colors and there was a strange noise.,12/2/2000,47.34444439999999,-122.76194440000002
10/1/2000 01:30,sturgis,mi,us,disk,600.0,9 to 10 min.,THE OBJECT WAS UP TO HIGH FOR DETAIL BUT WAS CIRCLE IN SHAPE AND WAS BRIGHT WHITE LIGHT,4/1/2001,41.7991667,-85.4191667
10/1/2000 09:00,markham (canada),on,ca,cigar,600.0,10 min,It was some time in oct 2000.I was taking my wife to work on Markham road&#44 traveling south bound. There was a lot of traffic and lots o,8/5/2009,43.866667,-79.266667
10/1/2000 13:00,yangtzee river (china),,,disk,900.0,15 minutes,Picture taken of disk in sky&#44 that appears to be somthing out of the ordinary.,7/5/2008,31.846940000000004,120.872862
10/1/2000 14:00,madera,ca,us,light,120.0,2 minutes,A bright oval shaped light flying faster than anything I had ever seen before.,8/30/2013,36.9613889,-120.0597222
10/1/2000 18:00,stockton,ca,us,sphere,180.0,2-3 minutes,Two strange bright objects at dusk in the central valley.,7/1/2002,37.9577778,-121.2897222
10/1/2000 19:40,chandler,az,us,cigar,20.0,20 sec,tHIS IS A CORRECTION TO A REPORT THAT I MADE LAST WEEK.   WHEN WE SAW THE LIGHT MY WIFE AND NEIGHBOR WERE BEHIND ME AND THEY WSAW THE O,12/2/2000,33.3061111,-111.8405556
10/1/2000 20:00,belmont,ca,us,unknown,15.0,15 seconds,Faint starlike object  moving in space at high speed stopped and lined up with other 3 faint stars.,12/2/2000,37.5202778,-122.2747222
10/1/2000 20:00,prineville,or,us,unknown,3600.0,1 hour,bright white light the size of a distant star that made eratic movements&#44 and complete stops,12/20/2000,44.3,-120.8333333
10/1/2000 20:00,tillicoultry (central scotland) (uk/scotland),,gb,triangle,60.0,1 min,Hovered&#44 huge&#44 flashing&#44 silent&#44 wierd.,5/24/2005,56.15,-3.75
10/1/2000 20:00,wheaton,md,us,triangle,300.0,5 minutes,UFO sighted in Wheaton&#44 MD,10/30/2006,39.0397222,-77.0555556
10/1/2000 21:00,orange park,fl,us,other,10.0,10 seconds,Two points of light darted across the sky side by side&#44 crossed paths and continued out over the Florida Panhandle,8/5/2001,30.1658333,-81.7066667
10/1/2000 21:30,colorado springs,co,us,light,300.0,3 to 5 minutes,saw 4 lights going in what i thought was a clover formation,12/2/2000,38.8338889,-104.8208333
10/1/2000 21:30,maryville,mo,us,light,30.0,about-30sec,white disappearing lights,12/2/2000,40.3461111,-94.8722222
10/1/2000 22:00,healesville. victoria (australia),,,light,40.0,2/3 minutes,light in sky projecting &quot;beam&quot;.,8/28/2003,-37.653829,145.517006
10/1/2000 22:00,jackson,tn,us,triangle,120.0,appox. 2 mins,Three glowing spheres under dark triangular shape&#44 no sound,11/20/2001,35.6144444,-88.81388890000002
10/1/2000 23:15,jones beach,ny,us,diamond,900.0,15 minutes,2 objects over jones beach NY&#44 sent Red beam then blue beam on our car.,12/2/2000,42.9047222,-76.3944444
10/1/2001 01:05,seattle,wa,us,,1.0,1 sec,just a meteor sighting...,10/12/2001,47.6063889,-122.33083329999998
10/1/2001 19:00,kansas city,mo,us,light,900.0,15 minutes,3 bright lights at high altitude west of Kansas City at 2100 hours on 10/1/01 in a general westward movement.,10/12/2001,39.0997222,-94.5783333
10/1/2001 20:30,houghton lake,mi,us,triangle,300.0,5 minutes,Spotted Triangular object while exiting highway&#44 almost crashed into cop&#44 was not even pulled over.,11/8/2003,44.3147222,-84.76472220000002
10/1/2001 20:35,greene,me,us,oval,10.0,10 seconds,Incandescent light-greenish Orb with Red Halo spotted in sky over Northern woods..................,10/12/2001,44.1897222,-70.1408333
10/1/2001 21:00,interstate 5 or tributary between vasilia and sacrammento,ca,,triangle,300.0,5 minutes,black triangle &#44 3 lights&#44 silent swift movement&#44 near air force base,1/31/2004,36.778261,-119.417932
10/1/2001 21:00,lafayette,ny,us,changing,180.0,3 minutes,Low flying object changed from bright blue square to red diamond shape...loud ..then silence and it was gone.,10/12/2001,42.8922222,-76.1055556
10/1/2001 22:00,lynden,wa,us,light,30.0,30 seconds,Outline: 1) Clear dark night.2) directly above me 3) appeared to be an orbitting satellite but was bluish and smaller than most.,7/1/2002,48.9466667,-122.4508333
10/1/2001 22:30,albany,ny,us,flash,2.0,2 seconds,Bright flash witnessed near Albany&#44 New York,6/12/2002,42.6525,-73.7566667
10/1/2001 24:00,chulucanas-piura la vieja (peru),,,other,6312000.0,2 years,go to:  http://www.24horas.com.pe/data/videos/reportajes/repor020203_2.php for a 15 min report that aired last Feb 2nd on Peruvian TV P,3/4/2003,-5.1295470000000005,-80.12056899999997
10/1/2002 00:30,courtland,va,us,circle,1.0,sec.,Look I can&#39t recall the date exactly&#44  but it was in that area of time especially the hour of night.  It could be in a range of two wee,12/23/2002,36.716111100000006,-77.06833329999998
10/1/2002 00:30,hong kong,,,formation,1800.0,30 minutes,Sighting in Hong Kong SAR,10/15/2002,22.396428,114.109497
10/1/2002 03:00,oakland,ca,us,oval,420.0,07:00,lights moving in the sky 7 landing in Oakland over coliseum &amp; airport,10/15/2002,37.8044444,-122.2697222
10/1/2002 05:30,everson,wa,us,other,5.0,4-5 seconds,Among the Northern lights a bright green fireball from West to East,10/15/2002,48.9202778,-122.3413889
10/1/2002 05:30,port townsend,wa,us,fireball,10.0,8-10 seconds,Giant Blue-Green fireball falls from the sky at 0530 in washington state,10/15/2002,48.1172222,-122.7591667
10/1/2002 05:30,snohomish,wa,us,sphere,3.0,2-3 seconds,A large metor going through the atmosphere&#44 white tail turning blue and then red/orange and disapear.,10/15/2002,47.91305560000001,-122.0969444
10/1/2002 05:30,sumner,wa,us,circle,330.0,05:30,While traveling north on hwy 167. A green light traveling from the west&#44 and heading east flew across the sky. The round light appearin,10/15/2002,47.2033333,-122.2391667
10/1/2002 05:35,pueblo,co,us,triangle,15.0,10-15seconds,Silent large flying v of 5 orange glowing patches gives fright.,10/15/2002,38.2544444,-104.6086111
10/1/2002 05:35,seattle,wa,us,unknown,1.0,a second?,On the morning of 10/01/02 I was driving to work on HI5 in Seattle Wa. and I was south bound by the old Rainier Brewery and saw a brigh,10/15/2002,47.6063889,-122.33083329999998
10/1/2002 05:42,seattle,wa,us,teardrop,3.0,3 seconds,Initially a comet in appearance&#44 but speed was too slow.,10/15/2002,47.6063889,-122.33083329999998
10/1/2002 05:43,seattle,wa,us,other,2.0,2 seconds,I saw a green object above Seattle&#44 at about 5:45 AM on 10/1&#44 occuring at the time of a northern lights display.,10/15/2002,47.6063889,-122.33083329999998
10/1/2002 05:45,kent,wa,us,unknown,10.0,10 seconds,STREK OF LIGHT ACROSS THE SKY,10/15/2002,47.38111110000001,-122.2336111
10/1/2002 05:45,lynnwood,wa,us,fireball,5.0,5 seconds,Large fireball sighting,10/15/2002,47.8211111,-122.3138889
10/1/2002 05:45,rainier,wa,us,light,240.0,3-4 min,I was taking my Boyfriend to work in yelm and as we entered onto koeppen rd and traveling north towards yelm We noticed to our left abo,10/15/2002,46.8883333,-122.6872222
10/1/2002 06:30,monroe,wi,us,light,1200.0,15-20 min,Very intense orange-yellow light moves from south to north in early A.M. and late P.M.,7/16/2006,42.6011111,-89.6383333
10/1/2002 06:30,natrona heights&#44 new kensington,pa,,light,7200.0,2 hours,Westmoreland &amp; Allegheny County UFO Phenomena Pink Columns Rays; 6 UFO&#39s: Tangerine Brillance Lights Manuevers clearly visible,10/30/2012,40.616187,-79.72411
10/1/2002 07:30,kingston,ny,us,cigar,600.0,10 mins,nys thruway heading nrth between exit 19 and 20 cigar shaped &#44reflective or silver in color &#44 incredable fast no sound .,3/4/2008,41.9269444,-73.9977778
10/1/2002 09:00,germantown,md,us,cigar,180.0,3 minutes,me and boyfriend out on the back deck drinking coffee and we see a cigar shaped craft flying overhead....it struck me as odd because it,8/11/2004,39.17305560000001,-77.2719444
10/1/2002 13:35,karavostasi (greece),,,cross,60.0,1 minute,a look-through aircraft a la &#39predator&#39,12/14/2004,39.337515,20.289964
10/1/2002 14:00,winslow,az,us,other,1800.0,15-30 mins,Silent average-looking airplane hovers over Leupp exit butte on I-40 for 15-30 mins&#44 hundreds of witnesses.,7/6/2010,35.0241667,-110.6966667
10/1/2002 15:00,athol,id,us,teardrop,300.0,3-5 min.,high polished chrome-teardrop shaped object hovering over a busy North Idaho Hi-way in mid afternoon,4/27/2004,47.9480556,-116.7069444
10/1/2002 16:00,grants,nm,us,fireball,10.0,3 to 10 seconds,In October 2002&#44 I was driving east on Interestate 40 (close to mile marker 100)&#44  when I saw a greenish &quot;comet-like&quot; shape movng very,4/22/2003,35.1472222,-107.8508333
10/1/2002 17:56,port hadlock,wa,us,fireball,5.0,5 seconds,big shooting star,10/15/2002,48.03194439999999,-122.7569444
10/1/2002 18:00,orlando,fl,us,other,4.0,4seconds,unusual shaped and transparent color crafts appear and one follow the other in new direction,10/11/2005,28.538055600000003,-81.3794444
